{
  "schema_version": "v0.2",
  "record_type": "learning_candidate",
  "id": "learning-demo",
  "created_at": "2026-09-10T00:00:00Z",
  "client_id": "client-demo",
  "hypothesis": "The reviewed, anonymized lesson is eligible for a general projection.",
  "scope": "One simulated receipt, promoted only after owner-linked review.",
  "stage": "reviewed",
  "evidence": [{"receipt_path": "receipts/operation-demo.json", "receipt_sha256": "aaaaaaaaaaaaaaaaaaaaaaaaaaaaaaaaaaaaaaaaaaaaaaaaaaaaaaaaaaaaaaaa"}],
  "reviewer": {"name": "Example reviewer", "decision": "accept", "review_binding_sha256": "bbbbbbbbbbbbbbbbbbbbbbbbbbbbbbbbbbbbbbbbbbbbbbbbbbbbbbbbbbbbbbbb"},
  "anonymized": true,
  "generalization": "reviewed_general",
  "promotion": {
    "reviewed_general_text": "Have an owner review completed outcomes before adapting the operating procedure."
  }
}
